{
  "robot": {
    "name": "validation_robot",
    "namespace": "validation_robot",
    "initial_pose": [0.0, 0.0, 0.21, 0.0, 0.0, 0.0]
  },
  "map_path": null,
  "nav2_parameters": null,
  "probe": {
    "linear_velocity_mps": 0.2,
    "drive_seconds": 3.0,
    "minimum_distance_m": 0.3,
    "maximum_distance_m": 0.9,
    "settle_seconds": 1.0
  }
}
